{
  "name": "pcb_design",
  "version": "0.2.2",
  "module": "argus_verticals.pcb_design.stages",
  "purpose_zh": "PCB 原理图、器件封装、叠层布局布线与制造准备；KiCad 铜区副本重填、ERC/DRC、图板一致性和 Gerber/钻孔输出",
  "paths": ["argus_verticals/pcb_design"],
  "requires": [],
  "shared": ["argus_verticals/hardware/shared"],
  "python_requirements": ["sexpdata>=1.0.2,<2"],
  "tags": ["hardware", "pcb", "kicad"],
  "maintainers": [],
  "min_argus": "vertical-routing-paths",
  "argus_features": ["composable-workflow-profiles", "vertical-routing-paths", "host-round-evidence"]
}
