{
  "name": "fpga_design",
  "version": "0.1.4",
  "module": "argus_verticals.fpga_design.stages",
  "purpose_zh": "FPGA 工程、资源推断、引脚和时钟约束及板级调试；首个可执行实现流程限定单时钟 iCE40，上板需真实测量",
  "paths": ["argus_verticals/fpga_design"],
  "requires": ["digital_circuit", "digital_circuit_verification"],
  "shared": ["argus_verticals/hardware/shared"],
  "python_requirements": [],
  "tags": ["hardware", "fpga", "verification"],
  "maintainers": [],
  "min_argus": "vertical-routing-paths",
  "argus_features": ["composable-workflow-profiles", "vertical-routing-paths", "host-round-evidence"]
}
