{
  "name": "digital_circuit_verification",
  "version": "0.3.0",
  "module": "argus_verticals.digital_circuit.verification.stages",
  "purpose_zh": "独立数字验证专项：需求覆盖矩阵、参数和种子回归、声明的单比特 CDC／复位链原生检查、形式证明及非空洞性检查",
  "paths": ["argus_verticals/digital_circuit/verification"],
  "requires": ["digital_circuit"],
  "shared": ["argus_verticals/hardware/shared"],
  "python_requirements": [],
  "tags": ["hardware", "verification", "formal", "cdc"],
  "maintainers": [],
  "min_argus": "vertical-routing-paths",
  "argus_features": ["composable-workflow-profiles", "vertical-routing-paths", "host-round-evidence"]
}
