{
  "name": "analog_mixed_signal",
  "version": "0.3.0",
  "module": "argus_verticals.analog_mixed_signal.stages",
  "purpose_zh": "模拟与混合信号电路：偏置、反馈、滤波、模型和接口；ngspice 直流、交流、瞬态、多工况裕量诊断与数值收敛",
  "paths": ["argus_verticals/analog_mixed_signal"],
  "requires": [],
  "shared": ["argus_verticals/hardware/shared", "argus_verticals/hardware/spice"],
  "python_requirements": [],
  "tags": ["hardware", "analog", "spice"],
  "maintainers": [],
  "min_argus": "vertical-routing-paths",
  "argus_features": ["composable-workflow-profiles", "vertical-routing-paths", "host-round-evidence"]
}
