{
  "name": "digital_circuit",
  "version": "1.2.1",
  "module": "argus_verticals.digital_circuit.stages",
  "purpose_zh": "体系化数字电路知识与 RTL：组合/时序、算术、FSM、FIFO、协议、CDC、验证和综合，支持按任务范围选择流程",
  "paths": [
    "argus_verticals/digital_circuit"
  ],
  "requires": [],
  "shared": ["argus_verticals/hardware/shared"],
  "python_requirements": [],
  "tags": [
    "hardware",
    "rtl",
    "verilog",
    "verification"
  ],
  "maintainers": [],
  "min_argus": "composable-workflow-profiles",
  "argus_features": ["composable-workflow-profiles", "vertical-routing-paths", "host-round-evidence"]
}
