{
  "name": "materials",
  "version": "0.1.0",
  "module": "argus_verticals.materials.stages",
  "purpose_zh": "材料科学与材料加工，跨原子、微观组织、连续介质、CAD/CAE 与实验尺度",
  "paths": [
    "argus_verticals/materials"
  ],
  "requires": [],
  "shared": [],
  "python_requirements": [],
  "tags": [
    "science",
    "materials",
    "simulation"
  ],
  "maintainers": [],
  "min_argus": "2026-09-14-split"
}
