{
  "name": "kernelbench",
  "version": "0.2.0",
  "module": "argus_verticals.kernelbench.stages",
  "purpose_zh": "在 B200 SOL-ExecBench/KernelBench 上最大化通过正确性检查的 GPU 内核 SOL 得分/加速比",
  "paths": [
    "argus_verticals/kernelbench"
  ],
  "requires": [],
  "shared": [],
  "python_requirements": [],
  "tags": [
    "gpu",
    "kernels",
    "benchmark",
    "optimization"
  ],
  "maintainers": [],
  "min_argus": "2026-09-14-split"
}
